{
  "$schema": "https://json-schema.org/draft/2019-09/schema",
  "$defs": {
    "string": {
      "type": "string",
      "minLength": 1
    }
  },
  "type": "object",
  "properties": {
    "appStatus": {
      "type": "object",
      "properties": {
        "cent": {
          "type": "object",
          "properties": {
            "Disconnected": {
              "$ref": "#/$defs/string"
            },
            "DisconnectedExplanation": {
              "$ref": "#/$defs/string"
            }
          },
          "required": ["Disconnected", "DisconnectedExplanation"]
        },
        "refresh": {
          "type": "object",
          "properties": {
            "NewAppAvailable": {
              "$ref": "#/$defs/string"
            },
            "NewAppAvailableExplanation": {
              "$ref": "#/$defs/string"
            }
          },
          "required": ["NewAppAvailable", "NewAppAvailableExplanation"]
        }
      },
      "required": ["cent", "refresh"]
    },
    "button": {
      "type": "object",
      "properties": {
        "Add": {
          "$ref": "#/$defs/string"
        },
        "Back": {
          "$ref": "#/$defs/string"
        },
        "Cancel": {
          "$ref": "#/$defs/string"
        },
        "ChooseIcon": {
          "$ref": "#/$defs/string"
        },
        "ChooseImage": {
          "$ref": "#/$defs/string"
        },
        "Close": {
          "$ref": "#/$defs/string"
        },
        "Confirm": {
          "$ref": "#/$defs/string"
        },
        "Copy": {
          "$ref": "#/$defs/string"
        },
        "Create": {
          "$ref": "#/$defs/string"
        },
        "Delete": {
          "$ref": "#/$defs/string"
        },
        "Details": {
          "$ref": "#/$defs/string"
        },
        "Edit": {
          "$ref": "#/$defs/string"
        },
        "ExportExcel": {
          "$ref": "#/$defs/string"
        },
        "ImportCsv": {
          "$ref": "#/$defs/string"
        },
        "Insert": {
          "$ref": "#/$defs/string"
        },
        "Next": {
          "$ref": "#/$defs/string"
        },
        "No": {
          "$ref": "#/$defs/string"
        },
        "OK": {
          "$ref": "#/$defs/string"
        },
        "Retry": {
          "$ref": "#/$defs/string"
        },
        "Save": {
          "$ref": "#/$defs/string"
        },
        "SelectAccount": {
          "$ref": "#/$defs/string"
        },
        "SelectPartner": {
          "$ref": "#/$defs/string"
        },
        "Yes": {
          "$ref": "#/$defs/string"
        }
      },
      "required": [
        "Add",
        "Back",
        "Cancel",
        "ChooseIcon",
        "ChooseImage",
        "Close",
        "Confirm",
        "Copy",
        "Create",
        "Delete",
        "Details",
        "Edit",
        "ExportExcel",
        "ImportCsv",
        "Insert",
        "Next",
        "No",
        "OK",
        "Retry",
        "Save",
        "SelectAccount",
        "SelectPartner",
        "Yes"
      ]
    },
    "check": {
      "type": "object",
      "properties": {
        "CheckAll": {
          "$ref": "#/$defs/string"
        }
      },
      "required": ["CheckAll"]
    },
    "currencyRateHint": {
      "type": "object",
      "properties": {
        "ExchangeCurrency": {
          "$ref": "#/$defs/string"
        }
      },
      "required": ["ExchangeCurrency"]
    },
    "date": {
      "type": "object",
      "properties": {
        "label": {
          "type": "object",
          "properties": {
            "SelectRange": {
              "$ref": "#/$defs/string"
            },
            "Today": {
              "$ref": "#/$defs/string"
            },
            "since": {
              "$ref": "#/$defs/string"
            },
            "until": {
              "$ref": "#/$defs/string"
            }
          },
          "required": ["SelectRange", "Today", "since", "until"]
        }
      },
      "required": ["label"]
    },
    "downgrade": {
      "type": "object",
      "properties": {
        "button": {
          "type": "object",
          "properties": {
            "Navigate": {
              "$ref": "#/$defs/string"
            }
          },
          "required": ["Navigate"]
        },
        "message": {
          "type": "object",
          "properties": {
            "PleaseProvideUsAReason": {
              "$ref": "#/$defs/string"
            }
          },
          "required": ["PleaseProvideUsAReason"]
        },
        "subtitle": {
          "$ref": "#/$defs/string"
        },
        "title": {
          "$ref": "#/$defs/string"
        }
      },
      "required": ["button", "message", "subtitle", "title"]
    },
    "field": {
      "type": "object",
      "properties": {
        "MonthLimit": {
          "$ref": "#/$defs/string"
        },
        "MonthPlan": {
          "$ref": "#/$defs/string"
        }
      },
      "required": ["MonthLimit", "MonthPlan"]
    },
    "label": {
      "type": "object",
      "properties": {
        "AskAQuestion": {
          "$ref": "#/$defs/string"
        },
        "DownloadAt": {
          "$ref": "#/$defs/string"
        },
        "FoundATypo": {
          "$ref": "#/$defs/string"
        },
        "and": {
          "$ref": "#/$defs/string"
        },
        "date": {
          "type": "object",
          "properties": {
            "sinceStart": {
              "$ref": "#/$defs/string"
            },
            "untilEnd": {
              "$ref": "#/$defs/string"
            }
          },
          "required": ["sinceStart", "untilEnd"]
        }
      },
      "required": ["AskAQuestion", "DownloadAt", "FoundATypo", "and", "date"]
    },
    "message": {
      "type": "object",
      "properties": {
        "CautionAboutDataLoss": {
          "$ref": "#/$defs/string"
        },
        "CheckFormAndFixErrors": {
          "$ref": "#/$defs/string"
        },
        "CouldNotPerformOperation": {
          "$ref": "#/$defs/string"
        },
        "Done": {
          "$ref": "#/$defs/string"
        },
        "NoRecords": {
          "$ref": "#/$defs/string"
        },
        "NothingWasFound": {
          "$ref": "#/$defs/string"
        },
        "PleaseWait": {
          "$ref": "#/$defs/string"
        },
        "TemporaryDisabled": {
          "$ref": "#/$defs/string"
        },
        "ThisActionCannotBeUndone": {
          "$ref": "#/$defs/string"
        },
        "UncaughtErrorExplanation": {
          "$ref": "#/$defs/string"
        },
        "UnknownError": {
          "$ref": "#/$defs/string"
        }
      },
      "required": [
        "CautionAboutDataLoss",
        "CheckFormAndFixErrors",
        "CouldNotPerformOperation",
        "Done",
        "NoRecords",
        "NothingWasFound",
        "PleaseWait",
        "TemporaryDisabled",
        "ThisActionCannotBeUndone",
        "UncaughtErrorExplanation",
        "UnknownError"
      ]
    },
    "placeholder": {
      "type": "object",
      "properties": {
        "Search": {
          "$ref": "#/$defs/string"
        },
        "SelectCountry": {
          "$ref": "#/$defs/string"
        },
        "SelectCryptExchanger": {
          "$ref": "#/$defs/string"
        },
        "SelectCurrency": {
          "$ref": "#/$defs/string"
        },
        "SelectDate": {
          "$ref": "#/$defs/string"
        },
        "SelectLanguage": {
          "$ref": "#/$defs/string"
        }
      },
      "required": [
        "Search",
        "SelectCountry",
        "SelectCryptExchanger",
        "SelectCurrency",
        "SelectDate",
        "SelectLanguage"
      ]
    },
    "select": {
      "type": "object",
      "properties": {
        "UseDefault": {
          "$ref": "#/$defs/string"
        },
        "payInterval": {
          "type": "object",
          "properties": {
            "Empty": {
              "$ref": "#/$defs/string"
            },
            "m": {
              "$ref": "#/$defs/string"
            },
            "q": {
              "$ref": "#/$defs/string"
            },
            "w": {
              "$ref": "#/$defs/string"
            }
          },
          "required": ["Empty", "m", "q", "w"]
        }
      },
      "required": ["UseDefault", "payInterval"]
    },
    "state": {
      "type": "object",
      "properties": {
        "Error": {
          "$ref": "#/$defs/string"
        },
        "Loading": {
          "$ref": "#/$defs/string"
        }
      },
      "required": ["Error", "Loading"]
    }
  },
  "required": [
    "appStatus",
    "button",
    "check",
    "currencyRateHint",
    "date",
    "downgrade",
    "field",
    "label",
    "message",
    "placeholder",
    "select",
    "state"
  ]
}
