{
  "appStatus": {
    "cent": {
      "Disconnected": "Соединение прервано",
      "DisconnectedExplanation": "Потеряно соединение с сервером. Некоторые процессы могут работать некорректно или не работать вовсе. Проверьте подключение к сети Интернет. Если вы уверены, что подключение в порядке, но ошибка проявляется длительное время, обратитесь к нам в поддержку."
    },
    "refresh": {
      "NewAppAvailable": "Доступна новая версия",
      "NewAppAvailableExplanation": "Доступна новая версия. <1>Обновить страницу</1>"
    }
  },
  "button": {
    "Add": "Добавить",
    "Back": "Назад",
    "Cancel": "Отмена",
    "ChooseIcon": "Выбрать иконку",
    "ChooseImage": "Выбрать изображение",
    "Close": "Закрыть",
    "Confirm": "Подтвердить",
    "Copy": "Копировать",
    "Create": "Создать",
    "Delete": "Удалить",
    "Details": "Подробнее",
    "Edit": "Редактировать",
    "ExportExcel": "Экспорт в Excel",
    "ImportCsv": "Импорт CSV",
    "Insert": "Вставить",
    "Next": "Далее",
    "No": "Нет",
    "OK": "OK",
    "Retry": "Повторить",
    "Save": "Сохранить",
    "SelectAccount": "Выберите счет",
    "SelectPartner": "Выберите контрагента",
    "Yes": "Да"
  },
  "check": {
    "CheckAll": "Выбрать все"
  },
  "currencyRateHint": {
    "ExchangeCurrency": "Обмен по курсу"
  },
  "date": {
    "label": {
      "SelectRange": "Выберите диапазон",
      "since": "с",
      "Today": "Сегодня",
      "until": "по"
    }
  },
  "downgrade": {
    "button": {
      "Navigate": "Перейти"
    },
    "message": {
      "PleaseProvideUsAReason": "Пожалуйста, укажите причину, чтобы мы могли улучшить на сервис."
    },
    "subtitle": "Это поможет стать нам лучше.",
    "title": "Напишите, что вам не понравилось?"
  },
  "field": {
    "MonthLimit": "Лимит в месяц",
    "MonthPlan": "План в месяц"
  },
  "label": {
    "and": "и",
    "AskAQuestion": "Задать вопрос",
    "date": {
      "sinceStart": "с начала",
      "untilEnd": "до конца"
    },
    "DownloadAt": "Скачать в",
    "FoundATypo": "Нашли опечатку?"
  },
  "message": {
    "CautionAboutDataLoss": "ПРЕДУПРЕЖДЕНИЕ О ПОТЕРЕ ДАННЫХ!",
    "CheckFormAndFixErrors": "Проверьте правильность заполнения полей и исправьте ошибки.",
    "CouldNotPerformOperation": "Не удалось выполнить операцию.",
    "Done": "Готово.",
    "NoRecords": "Ничего нет.",
    "NothingWasFound": "Ничего не найдено.",
    "PleaseWait": "Пожалуйста, подождите...",
    "TemporaryDisabled": "Временно отключено.",
    "ThisActionCannotBeUndone": "Это действие нельзя будет отменить.",
    "UncaughtErrorExplanation": "Извините, произошла ошибка. Для начала попробуйте <1>обновить страницу</1>. Если это не помогло, проверьте интернет соединение и настройки прокси. Если и это не помогло, обратитесь в нашу службу поддержки.",
    "UnknownError": "Неизвестная ошибка."
  },
  "placeholder": {
    "Search": "Поиск",
    "SelectCountry": "Выберите страну",
    "SelectCryptExchanger": "Выберите биржу криптовалют",
    "SelectCurrency": "Выберите валюту",
    "SelectDate": "Выберите дату",
    "SelectLanguage": "Выберите язык"
  },
  "select": {
    "payInterval": {
      "Empty": "Вручную",
      "m": "1 раз в месяц",
      "q": "1 раз в квартал",
      "w": "1 раз в неделю"
    },
    "UseDefault": "Использовать по умолчанию"
  },
  "state": {
    "Error": "Ошибка",
    "Loading": "Загрузка..."
  }
}
