{
  "appStatus": {
    "cent": {
      "Disconnected": "Connection lost",
      "DisconnectedExplanation": "Connection with server lost. Something can work incorrect or not work at all. Check you Internet connection. If you are sure you internet connection is fine, but the error still happens a long time, feel free to contact our support system."
    },
    "refresh": {
      "NewAppAvailable": "New version available",
      "NewAppAvailableExplanation": "A new version available. <1>Refresh page</1>"
    }
  },
  "button": {
    "Add": "Add",
    "Back": "Back",
    "Cancel": "Cancel",
    "ChooseIcon": "Choose icon",
    "ChooseImage": "Choose image",
    "Close": "Close",
    "Confirm": "Confirm",
    "Copy": "Copy",
    "Create": "Create",
    "Delete": "Delete",
    "Details": "Details",
    "Edit": "Edit",
    "ExportExcel": "Export to Excel",
    "ImportCsv": "Import CSV",
    "Insert": "Insert",
    "Next": "Next",
    "No": "No",
    "OK": "OK",
    "Retry": "Retry",
    "Save": "Save",
    "SelectAccount": "Select account",
    "SelectPartner": "Select partner",
    "Yes": "Yes"
  },
  "check": {
    "CheckAll": "Check all"
  },
  "currencyRateHint": {
    "ExchangeCurrency": "Exchange rate"
  },
  "date": {
    "label": {
      "SelectRange": "Select a range",
      "since": "since",
      "Today": "Today",
      "until": "until"
    }
  },
  "downgrade": {
    "button": {
      "Navigate": "Navigate"
    },
    "message": {
      "PleaseProvideUsAReason": "Please provide us a reason, so we would make our service better."
    },
    "subtitle": "It will help us to became better.",
    "title": "Write us what did you dislike?"
  },
  "field": {
    "MonthLimit": "Month limit",
    "MonthPlan": "Month plan"
  },
  "label": {
    "and": "and",
    "AskAQuestion": "Ask a question",
    "date": {
      "sinceStart": "start",
      "untilEnd": "end"
    },
    "DownloadAt": "Download at",
    "FoundATypo": "Found a typo?"
  },
  "message": {
    "CautionAboutDataLoss": "CAUTION ABOUT DATA LOSS!",
    "CheckFormAndFixErrors": "Check data correctness and fix errors.",
    "CouldNotPerformOperation": "Couldn't perform operation.",
    "Done": "Done",
    "NoRecords": "Nothing here.",
    "NothingWasFound": "Nothing was found.",
    "PleaseWait": "Please, wait...",
    "TemporaryDisabled": "Temporary disabled.",
    "ThisActionCannotBeUndone": "This action cannot be undone",
    "UncaughtErrorExplanation": "Sorry, an error occurred. Try to <1>reload page</1> first. If it didn't help, check internet connection and proxy settings. If it didn't help too, contact out support system.",
    "UnknownError": "Unknown error."
  },
  "placeholder": {
    "Search": "Search",
    "SelectCountry": "Select country",
    "SelectCryptExchanger": "Select crypt exchanger",
    "SelectCurrency": "Select currency",
    "SelectDate": "Select date",
    "SelectLanguage": "Select language"
  },
  "select": {
    "payInterval": {
      "Empty": "none",
      "m": "every month",
      "q": "every quarter",
      "w": "every week"
    },
    "UseDefault": "Use default"
  },
  "state": {
    "Error": "Error",
    "Loading": "Loading..."
  }
}
